181|Người lái xe taxi phải thực hiện các quy định nào dưới đây?|Phải đón, trả hành khách theo thỏa thuận giữa hành khách và người lái xe nhưng phải chấp hành các quy định của pháp luật về trật tự, an toàn giao thông đường bộ khi đón, trả hành khách.|Phải hoạt động đúng tuyến, đúng lịch trình, thời gian được phép hoạt động và dừng xe, đỗ xe đúng nơi quy định.|Tất cả các ý nêu trên.|||1|2|0|0|0|1|1|1|1||Xe taxi đón trả khách theo thỏa thuận.
182|Người lái xe ô tô vận chuyển hành khách không được thực hiện các quy định nào dưới đây?|Chở hàng hóa nguy hiểm, hàng hóa cấm lưu hành, hàng lậu, động vật hoang dã, hàng có mùi hôi thối hoặc động vật, hàng hóa khác có ảnh hưởng đến sức khỏe của hành khách, môi trường.|Chở quá số người, chở hành lý, hàng hóa vượt quá khối lượng cho phép hoặc vi phạm quy định khác của pháp luật; chở hàng hóa trong khoang chở hành khách.|Tất cả các ý trên.|||4|2|0|0|0|1|1|1|1||Xe chở khách không chở hàng nguy hiểm và không chở quá số người quy định.
183|Hàng siêu trường, siêu trọng được hiểu như thế nào là đúng?|Là hàng có kích thước hoặc khối lượng vượt quá giới hạn về kích thước hoặc khối lượng quy định cho phép của xe dùng để chuyên chở.|Là hàng có thể chia nhỏ, tháo rời hoặc được xếp trong thùng kín, vận chuyển trên đường bộ để đảm bảo an toàn.|Là hàng không thể chia nhỏ, tháo rời, khi vận chuyển trên đường bộ làm cho phương tiện hoặc tổ hợp phương tiện bị vượt quá giới hạn cho phép tham gia giao thông đường bộ về kích thước, khối lượng theo quy định của pháp luật.|||4|2|0|0|0|1|1|1|1||Hàng siêu trường, siêu trọng là hàng không thể chia nhỏ.
184|Khi vận chuyển động vật sống, người lái xe phải thực hiện các quy định nào dưới đây?|Người lái xe phải mang đủ giấy tờ theo quy định của pháp luật; phương tiện vận chuyển phải có kết cấu phù hợp với loại động vật chuyên chở.|Trong quá trình vận chuyển phải chấp hành các quy định của pháp luật về trật tự, an toàn giao thông đường bộ, vệ sinh dịch tễ, phòng dịch và bảo đảm vệ sinh môi trường.|Tất cả các ý trên.|||4|2|0|0|0|1|1|1|1||Chở động vật sống phải có đủ giấy tờ và vệ sinh dịch tễ.
185|Xe quá khổ giới hạn, xe quá tải trọng, xe bánh xích chỉ được lưu hành trên đường bộ trong các trường hợp nào nêu dưới đây?|Sau khi được cấp giấy phép lưu hành xe quá khổ giới hạn, xe quá tải trọng, xe bánh xích; đã thực hiện các biện pháp bảo vệ công trình đường bộ theo quy định.|Sau khi được cấp giấy chứng nhận kiểm định chất lượng an toàn kỹ thuật và bảo vệ môi trường cho xe chở hàng quá khổ giới hạn, xe quá tải trọng, xe bánh xích; đã có kế hoạch thực hiện các biện pháp bảo vệ công trình đường bộ theo quy định.|Tất cả các ý trên.|||1|2|0|0|0|1|1|1|1||Xe quá khổ, xe quá tải trọng phải được cấp giấy phép lưu hành.
186|Người lái xe ô tô đưa đón trẻ em mầm non, học sinh phải có kinh nghiệm lái xe vận tải hành khách tối thiểu bao nhiêu năm?|02 năm.|03 năm.|04 năm.|||1|2|0|0|0|1|1|1|1||Kinh nghiệm lái xe tối thiểu chở trẻ em mầm non là 02 năm.
187|Khi vận chuyển hàng hóa nguy hiểm, người lái xe phải thực hiện các quy định nào dưới đây?|Việc vận chuyển hàng hóa nguy hiểm phải có giấy phép vận chuyển; trong trường hợp cần thiết, đơn vị vận chuyển hàng hóa nguy hiểm phải bố trí người áp tải để bảo đảm trật tự, an toàn giao thông đường bộ.|Xe ô tô vận chuyển hàng hóa nguy hiểm phải dán biểu trưng nhận diện hàng hóa nguy hiểm; lắp đèn, tín hiệu cảnh báo; người lái xe hoặc người áp tải vận chuyển hàng hóa nguy hiểm phải được tập huấn về vận chuyển hàng hóa nguy hiểm.|Tất cả các ý trên.|||4|2|0|0|0|1|1|1|1||Xe chở hàng nguy hiểm phải có giấy phép và biểu trưng nguy hiểm.
188|Xe bốn bánh có gắn động cơ vận chuyển hành khách phải đáp ứng các yêu cầu nào được nêu dưới đây?|Niêm yết tên và số điện thoại của tổ chức, cá nhân kinh doanh vận tải; niêm yết giá cước vận tải; hoạt động trên tất cả các tuyến đường giao thông công cộng có đủ điều kiện.|Niêm yết tên và số điện thoại của tổ chức, cá nhân kinh doanh vận tải; niêm yết giá cước vận tải; hoạt động đúng thời gian và phạm vi hoạt động theo quy định của Uỷ ban nhân dân cấp tỉnh.|Tất cả các ý trên.|||2|2|0|0|0|1|1|1|1||Xe bốn bánh gắn động cơ hoạt động theo quy định UBND cấp tỉnh.
189|Xe bốn bánh có gắn động cơ vận chuyển hàng hóa phải đáp ứng các yêu cầu nào được nêu dưới đây?|Niêm yết tên và số điện thoại của tổ chức, cá nhân kinh doanh vận tải; hoạt động đúng thời gian và phạm vi hoạt động theo quy định của Uỷ ban nhân dân cấp tỉnh.|Niêm yết tên và số điện thoại của tổ chức, cá nhân kinh doanh vận tải; niêm yết giá cước vận tải; hoạt động trên tất cả các tuyến đường giao thông công cộng có đủ điều kiện.||||1|2|0|0|0|1|1|1|1||Xe bốn bánh gắn động cơ hoạt động theo quy định UBND cấp tỉnh.
190|Xe cứu hộ giao thông đường bộ phải đảm bảo các điều kiện nào được nêu dưới đây?|Có dấu hiệu nhận diện, niêm yết thông tin trên xe; có gắn thiết bị giám sát hành trình và thiết bị ghi nhận hình ảnh người lái xe theo quy định.|Có thiết bị ghi nhận hình ảnh xe được cứu hộ và có đèn, thiết bị cảnh báo loại xe được ưu tiên trong quá trình cứu hộ.||||1|2|0|0|0|1|1|1|1||Xe cứu hộ giao thông phải có dấu hiệu nhận diện.
191|Xe cứu hộ giao thông đường bộ gồm những loại xe nào được nêu dưới đây?|Xe ô tô tải hoặc ô con có trang bị các dụng cụ, thiết bị phục vụ cho việc sửa chữa, khắc phục các hư hỏng của phương tiện giao thông đường bộ bị hư hỏng, bị sự cố.|Xe ô tô chở người có trang bị các dụng cụ, thiết bị phục vụ cho việc sửa chữa, khắc phục các hư hỏng của phương tiện giao thông đường bộ bị hư hỏng, bị sự cố.|Xe ô tô chuyên dùng có trang bị dụng cụ, thiết bị dùng để cứu hộ, hỗ trợ di chuyển hoặc chuyên chở các phương tiện giao thông đường bộ bị hư hỏng, bị sự cố.|||4|2|0|0|0|1|1|1|1||Xe cứu hộ giao thông là xe ô tô chuyên dùng.
192|Xe cơ giới quá khổ giới hạn bao gồm các loại xe nào được nêu dưới đây?|Xe có khối lượng toàn bộ vượt quá khối lượng cho phép của xe hoặc vượt quá tải trọng của đường bộ; xe có khối lượng toàn bộ phân bổ lên trục xe, cụm trục xe vượt quá tải trọng của trục xe, cụm trục xe hoặc vượt quá tải trọng của đường bộ.|Xe có kích thước bao ngoài vượt quá kích thước giới hạn cho phép của xe theo quy chuẩn kỹ thuật quốc gia về xe cơ giới; xe có kích thước bao ngoài quá khổ giới hạn của đường bộ; xe khi chở hàng hóa có kích thước bao ngoài của xe và hàng hóa vượt quá kích thước giới hạn cho phép xếp hàng hóa của xe hoặc quá khổ giới hạn của đường bộ.||||2|2|0|0|0|1|1|1|1||Xe quá khổ vượt giới hạn theo quy chuẩn kỹ thuật quốc gia.
143|Tại các điểm giao cắt giữa đường bộ và đường sắt, quyền ưu tiên thuộc về loại phương tiện nào dưới đây?|Xe chữa cháy của Cảnh sát phòng cháy, chữa cháy và cứu nạn, cứu hộ và xe chữa cháy của các lực lượng khác được huy động đi làm nhiệm vụ chữa cháy.|Xe cứu thương đi làm nhiệm vụ cấp cứu.|Phương tiện giao thông đường sắt.|Xe máy chuyên dùng.||4|1|0|120|143|1|1|1|1|1|Phương tiện giao thông đường sắt ưu tiên cao nhất.
148|Người và phương tiện tham gia giao thông đường bộ phải giảm tốc độ, đi sát lề đường bên phải hoặc dừng lại để nhường đường trong trường hợp nào dưới đây?|Khi gặp xe cấp cứu.|Khi gặp xe chữa cháy.|Khi gặp đoàn xe tang.|Khi gặp xe ưu tiên có tín hiệu ưu tiên.||8|1|0|125|148|1|1|1|1||Nhường đường khi gặp xe ưu tiên có tín hiệu ưu tiên.
150|Khi xe ô tô, mô tô đến gần vị trí giao nhau giữa đường bộ và đường sắt không có rào chắn, khi đèn tín hiệu màu đỏ đã bật sáng hoặc khi có tiếng chuông báo hiệu, người lái xe xử lý như thế nào?|Dừng lại về bên phải đường của mình tại vị trí cảm thấy an toàn.|Nhanh chóng cho xe vượt qua đường sắt trước khi tàu hỏa tới.|Giảm tốc độ cho xe vượt qua đường sắt trước khi tàu hỏa tới.|Dừng lại về bên phải đường của mình, trước vạch dừng xe.||8|1|77|127|150|1|1|1|1|1|Có tín hiệu đường sắt thì dừng trước vạch dừng xe.
157|Theo Luật Trật tự, an toàn giao thông đường bộ, tín hiệu đèn giao thông gồm những màu sắc nào?|Đỏ - Vàng - Xanh.|Cam - Vàng - Xanh.|Vàng - Xanh dương - Xanh lá.|Đỏ - Cam - Xanh.||1|1|79|132|157|1|1|1|1||Màu đèn tín hiệu: Đỏ vàng xanh.
163|Khi dừng, đỗ xe trên đường phố hẹp, người lái xe ô tô phải dừng, đỗ xe ở vị trí cách xe ô tô đang đỗ bên kia đường khoảng cách tối thiểu là bao nhiêu mét trong các trường hợp dưới đây để đảm bảo an toàn giao thông?|5 mét.|10 mét.|15 mét.|20 mét.||8|1|0|136|163|1|1|1|1||Cách xe ô tô đang đỗ ngược chiều dưới 20 mét trên đường phố hẹp, dưới 40 mét trên đường có một làn xe cơ giới trên một chiều đường;
